{
  "$schema": "https://json-schema.org/draft/2020-12/schema",
  "type": "array",
  "items": {
    "type": "object",
    "required": ["id", "title", "flavor", "tags"],
    "properties": {
      "id": { "type": "string" },
      "title": { "type": "string" },
      "flavor": { "type": "string" },
      "tags": { "type": "array", "items": { "type": "string" } }
    }
  }
}
